{
  "$schema": "https://json-schema.org/draft/2020-12/schema",
  "$id": "bug-priority-rubric-schema.json",
  "title": "Bug Priority Rubric",
  "description": "Contract for the impact-to-priority rubric shared by /bug (filing priority), the severity-proportionate review criterion and /resolve-review's priority correction (#2992). One file, three readers, so the three cannot drift.",
  "type": "object",
  "required": ["version", "precedence", "classes", "fallback"],
  "additionalProperties": false,
  "$defs": {
    "priority": {
      "type": "string",
      "enum": ["p0", "p1", "p2"],
      "description": "Board priority alias as declared under .gh-pmu.json fields.priority.values."
    }
  },
  "properties": {
    "$schema": { "type": "string" },
    "version": { "type": "integer", "minimum": 1 },
    "_meta": {
      "type": "object",
      "description": "Provenance. Not read at runtime.",
      "additionalProperties": true
    },
    "precedence": {
      "type": "string",
      "minLength": 20,
      "description": "How to resolve a bug matching several classes."
    },
    "classes": {
      "type": "array",
      "minItems": 1,
      "items": {
        "type": "object",
        "required": ["id", "priority", "description", "signals"],
        "additionalProperties": false,
        "properties": {
          "id": { "type": "string", "pattern": "^[a-z][a-z0-9-]*$" },
          "priority": { "$ref": "#/$defs/priority" },
          "description": { "type": "string", "minLength": 10 },
          "signals": {
            "type": "array",
            "minItems": 1,
            "items": { "type": "string", "minLength": 3 },
            "description": "Evidence a reader looks for in the bug's Description, Actual Behavior, Scope or Deployment Impact. Guidance for judgment, not a keyword matcher."
          }
        }
      }
    },
    "fallback": {
      "type": "object",
      "required": ["priority", "reason"],
      "additionalProperties": false,
      "properties": {
        "priority": { "$ref": "#/$defs/priority" },
        "reason": { "type": "string", "minLength": 20 }
      },
      "description": "Priority used when the described impact matches no class. The reason is stated to the user rather than the choice being made silently."
    }
  }
}
